"TNOA";"El Bracho - Villa Quinteros";"LAT DT 132 KV"
"TNOA";"ET La Rioja Sur ";"LAT DT 132 kV Recreo - La Rioja Norte y realización de nuevas acometidas a la ET La Rioja Sur 500/132 kV."
"TNOA";"ET Yuto";"Nueva ET Yuto 132 kv"
"TNOA";"Estación de Maniobra San Martín";"Nueve campos 132 kV, ocho campos salida de LAT 132 kV y un Campo de Transferencia"
"TNOA";"San Martín - Valle Viejo";"•  LAT DT 132 kV "
"TNOA";"Villa Quinteros - Huacra - Catamarca";"•  LAT 132 kV"
"TNOA";"El Bracho - Cevil Pozo";"Saturación de LAT 132 kV
Ampliación de la ET Cevil Pozo
(construcción de dos campos salida de LAT 132 kV y la apertura correspondiente de LAT 132kV El Bracho - Tucumán Norte)"
"TNOA";"ET El Bracho - (Tucumán Norte, futura ET Los Nogales, etc.)";"Como medida definitiva se requiere la construcción de en un vínculo adicional desde ET El Bracho hacia alguna ET del área (Tucumán Norte, futura ET Los Nogales, etc.), o bien una nueva ET 500/132kV en la zona norte de Tucumán."
"TNOA";"Güemes - San Juancito";"Saturación de LAT 132 kV 
construcción de una segunda terna en 132 kV entre las estaciones Güemes y San Juancito."
"TNOA";"Santiago - Santiago Sur";"Se propone acelerar la gestión, construcción y habilitación de por lo menos alguna de las siguientes obras:
•  Corredor 132 kV Santiago Oeste - La Fandet - La Banda, obra con Solicitud de Acceso en trámite;
•  Corredor 132 kV Santiago - Primera Junta - Libertad - Santiago Este.
•  LAT 132 kV Santiago - Santiago Centro. Obra con Solicitud de Acceso en trámite.
"
"TNOA";"ET La Rioja Norte";"Transformadores T3 y T4 comandados por interruptor único"
"TNOA";"ET Circunvalación";" Transformadores T1 y T2 comandados por interruptor único"
"TNOA";"ET Sarmiento";"Transformadores T1 y T3 comandados por interruptor único"
"TNOA";"ET Tucumán Norte";"Transformador T3 comandado por interruptor salida LAT 132 kV a Tucumán Oeste."
"TNOA";"ET Las Maderas";"Transformadores T1 y T2 comandados por interruptor único"
"TNOA";"ET Jujuy Este";"Transformadores T1 y T3 comandados por interruptor único"
"TNOA";"ET Aimogasta";"Falta interruptor salida LAT 132 kV a Parque Arauco"
"TNOA";"ET Patquía";"Falta interruptor salida LAT 132 kV a Nonogasta."
"TNOA";"ET Villa Unión";"Falta interruptor salida LAT 132 KV Nonogasta."
"TNOA";"ET Chamical";"Falta interruptor salida LAT 132 kV a Patquía"
"TNOA";"ET Tartagal";"Falta interruptor salida LAT 132 kV a Pichanal"
"TNOA";"CH El Cadillal";"Falta interruptor salida LAT 132 kV a Tucumán Norte."
"TNOA";"ET Circunvalación";"Conexión en “T” faltan dos interruptores salida LAT 132 kV."
"TNOA";" ET Aconquija";"Conexión en “T” falta interruptor salida LAT 132 kV."
"TNOA";"ET Pantanillo";"Conexión en “T” faltan dos interruptores salida LAT 132 KV."
"TNOA";"ET Valle Viejo";"Conexión en “T” faltan dos interruptores salida LAT 132 KV"
"TNOA";"ET Fernández";"Conexión en “T” faltan dos interruptores salida LAT 132 KV."
"TNOA";"ET Añatuya";"Falta campo salida de línea 132 kV a ET Suncho Corral."
"TNOA";"ET Lules";"Conexión en “T”, faltan dos campos salida de línea 132 kV."
"TNOA";"Corredor Radial Pichanal - Tartagal";"Restricciones para la ejecución de mantenimientos de equipos"
"TNOA";"Pichanal - T abacal - Orán.";"Restricciones para la ejecución de mantenimientos de equipos"
"TNOA";"Villa Quinteros - Aconquija (esquema T) - Andalgalá - Belén - Tinogasta.";"Restricciones para la ejecución de mantenimientos de equipos"
"TNOA";"Andalgalá - Saujil.";"Restricciones para la ejecución de mantenimientos de equipos"
"TNOA";"Suncho Corral - Añatuya - Bandera.";"Restricciones para la ejecución de mantenimientos de equipos"
"TNOA";"La Rioja Sur - Patquía - Nonogasta - Malligasta - Villa Unión";"Restricciones para la ejecución de mantenimientos de equipos"
"TNOA";"Patquía - Chamical";"Restricciones para la ejecución de mantenimientos de equipos"
"TNOA";"La Rioja Norte - Parque Arauco - Aimogasta";"Restricciones para la ejecución de mantenimientos de equipos"
"TNOA";"Independencia - Papelera Tucumán - Lules.";"Restricciones para la ejecución de mantenimientos de equipos"
"TNOA";"Villa Quinteros - Aguilares.";"Restricciones para la ejecución de mantenimientos de equipos"
"TNOA";"Cevil Pozo - Avellaneda";"Restricciones para la ejecución de mantenimientos de equipos"
"TNOA";"Pampa Grande - Cafayate";"Restricciones para la ejecución de mantenimientos de equipos"
"TNOA";"Los Pizarros - La Cocha";"Restricciones para la ejecución de mantenimientos de equipos"
"TNOA";" Recreo - Catamarca - Huacra - La Calera - Frías - Recreo";"Corredores en zonas malladas que abastecen altas demandas con baja generación"
"TNOA";"Recreo - La Rioja Norte";"Corredores en zonas malladas que abastecen altas demandas con baja generación"
"TNOA";"El Bracho - Independencia - Agua Blanca";"Corredores en zonas malladas que abastecen altas demandas con baja generación"
"TNOA";"Güemes - Las Maderas - Jujuy Sur - Jujuy Este - Palpalá - San Juancito";"Corredores en zonas malladas que abastecen altas demandas con baja generación"
"TNOA";"ET La Rioja Norte I";"Existe un elevado número de estaciones transformadoras con reducida capacidad de reserva. Esta situación compromete la realización de mantenimientos programados"
"TNOA";"ET Catamarca I";"Existe un elevado número de estaciones transformadoras con reducida capacidad de reserva. Esta situación compromete la realización de mantenimientos programados"
"TNOA";"ET Agua Blanca";"Existe un elevado número de estaciones transformadoras con reducida capacidad de reserva. Esta situación compromete la realización de mantenimientos programados"
"TNOA";"ET Palpalá";"Existe un elevado número de estaciones transformadoras con reducida capacidad de reserva. Esta situación compromete la realización de mantenimientos programados"
"TNOA";"ET Avellaneda";"Existe un elevado número de estaciones transformadoras con reducida capacidad de reserva. Esta situación compromete la realización de mantenimientos programados"
"TNOA";"ET Cevil Pozo";"Existe un elevado número de estaciones transformadoras con reducida capacidad de reserva. Esta situación compromete la realización de mantenimientos programados"
"TNOA";"ET Salta Sur";"Existe un elevado número de estaciones transformadoras con reducida capacidad de reserva. Esta situación compromete la realización de mantenimientos programados"
"TNOA";"ET Jujuy Sur";"Existe un elevado número de estaciones transformadoras con reducida capacidad de reserva. Esta situación compromete la realización de mantenimientos programados"
"TNOA";"ET Libertador";"Existe un elevado número de estaciones transformadoras con reducida capacidad de reserva. Esta situación compromete la realización de mantenimientos programados"
"TNEA";"ET Gran Formosa - Et formosa II";"segunda línea conformando una doble terna entra las EETT Gran Formosa y
Formosa II, tendrá la misma capacidad que la línea existente"
"TNEA";"LAT: ET Formosa I – ET Formosa II";"Elevado nivel de carga en las líneas que
abastecen el área."
"TNEA";"Doble Terna: ET Formosa III – Mansilla/Formosa I";"Esta doble terna en 132 kV alimentará a la nueva ET Formosa III"
"TNEA";"LAT: ET Gran Formosa – ET Clorinda:";"Completa una doble terna con la línea actual que une ambas EE.TT."
"TNEA";"LAT: ET Gran Formosa – ET Pirané.";"La actual LAT que une la ET Gran Formosa con la ET Pirané."
"TNEA";"Doble Terna: ET Resistencia – ET Fontana";"Doble terna
que permitirá abastecer en 132kv desde Resistencia.
"
"TNEA";"LAT: ET Fontana – ET Vilelas:";"Línea en servicio."
"TNEA";"LAT: ET Vilelas – CD6/Barranqueras";"doble vínculo de la ET Vilelas"
"TNEA";"Doble Terna: ET Chaco – Saenz Peña/Villa Angela";"longitud de la línea es de solo 300 mts hasta alcanzar la línea existente entre Seanz Peña y Villa
Ángela"
"TNEA";"LAT: ET San Martín – ET Pcia. Roca";"Línea que alimentará la nueva ET Presidencia Roca."
"TNEA";"LAT: Saenz Peña – Castelli (Tramo Tres Isletas – Castelli)";"
"TNEA";"LAT: ET Castelli – ET Ibarreta";"en conjunto con la Línea Castelli – Saenz Peña, permite cerrar el anillo, y genera una
nueva vía de abastecimiento."
"TNEA";"LAT: ET San Bernardo – Villa Ángela/Saenz Peña";"Línea de 132 kV desde la futura nueva ET San Bernardo hasta la actual línea Saenz Peña-Villa Ángela"
"TNEA";"LEAT: ET Rincón – ET Resistencia:";"Línea de 500 kV, las estructuras ya están montadas."
"TNEA";"Doble Terna: ET Paso de la Patria – ET Corrientes Este:";"Doble terna en 132.
Kv"
"TNEA";"Doble Terna: ET Ita Ibate – ET Pirayu";"Nueva vía de
abastecimiento en 132kv desde la ET Paso de la Patria o la ET Rincón."
"TNEA";"Doble Terna: ET Saladas – ET Colonia Brugne";"se alimenta desde Colonia Brugne en 33kv, por lo tanto, se
ampliará la capacidad de alimentación con esta doble terna."
"TNEA";"Doble Terna: ET Bella Vista – ET Santa Rosa:";"Segunda línea de 33kV entre ambas estaciones"
"TNEA";"LAT: ET Los Conquistadores – ET La Paz";"Nueva línea
de 132 kV entre las estaciones transformadores de La Paz y Los Conquistadores"
"TNEA";"ET Yapeyú";"Estación Transformadora que funciona en
MT para poder ser alimentada en 132kV, con vínculos en la ET Paso de los Libres 2 y La Cruz.
Contará con un Transformador de 7,5MVA"
"TNEA";"ET Goya Oeste,";"Dos líneas de
132 kV provenientes de la ET Mercedes 132"
"TNEA";"ET Formosa III";"Aumento de la capacidad de transformación."
"Transco";"Desde la intersección de las calles Maipú y El Chingolo de G. Roca hasta la ET GR por Colonia Penal de G. Roca y calle Italia";"Cambio de sección en 1,5 Km de línea 132 KV TERMOROCA – G. ROCA (TRGR) de 150/25 mm² Al/Ac a 240/40 mm²."
"Transco";"650 m. al O. de calle JM de Rosas y 950 m al N de calle Río Limay de ALLEN, próximo a piquete N°46 de línea CP-GR.";"ET completa, cuadro de estación de 1 Ha, 2 campos de
línea de 132 KV, 1 Transformador 132/33/13,2 KV – 30/30/30 con campos de 132 y 13,2 KV equipados, edificio, etc."
"Transco";"Estación Transformadora TERMOROCA.";"Transformador de Rebaje 132/33/13,2 KV en ET TERMOROCA (ET TR)."
"Transco";"Calle San Luis 2423 – Cipolletti.";"LAT doble terna de 132 KV de 1,25 Km (L= 2,5 Km), 240/40
mm2 Al/Ac, ET completa con cuadro de estación de 1 Ha, 2 campos de línea de 132 KV, 1 Transformador 132/33/13,2 KV – 30/30/30 con campos de 132 y 13,2 KV equipados, edificio, paredones circundantes, etc."
"Transco";"Localidad de Ing. Huergo, próximo a LAT GR-VR";"ET completa, cuadro de estación de 1 Ha, 2 campos de
línea de 132 KV, 1 Transformador 132/33/13,2 KV – 15/10/15 con campos de 132 y 13,2 KV equipados, edificio, etc."
"Transco";"Cruce RN N° 151 y RP N° 69, próximo a LAT CC-ME";"ET completa, cuadro de estación de 1 Ha, 2 campos de
línea de 132 KV, 1 Transformador 132/33/13,2 KV – 15/10/15 con campos de 132 y 13,2 KV equipados, edificio, etc."
"Transco";"Ciudad de Catriel, próximo a LAT ME-LD";"ET completa, cuadro de estación de 1 Ha, 2 campos de
línea de 132 KV, 1 Transformador 132/33/13,2 KV – 15/10/15 con campos de 132, 33 y 13,2 KV equipados, barras de 13,2 KV, dos alimentadores de 33 KV, tres alimentadores de 13,2 KV, transformador creador de neutro artificial (TRN), transformador de SSAA, edificio, etc."
"Transco";"ET General Roca.";"Barras de 132 KV y Seccionador longitudinal de barras."
"Transco";"ET Medanito";"de 132 KV y 33 KV, de potencia y protección con vida útil cumplida y en riesgo de colapso."
"Transco";"ET Choele Choel de Transener.";"T5CL – Campo 132 KV"
"Transba";"ET Brandsen";"Nueva ET Brandsen-132/33/13.2 kV (2x 30 MVA), seccionando la LAT Chascomus-Monte"
"Transba";"ET Tandil Industrial";"Nueva ET Tandil Industrial-132/33/13.2 kV (2 x 30 MVA) seccionando la LAT Olavarría-Tandil"
"Transba";"ET Norte";"Nueva ET Norte-132/33/13.2 kV (2 x 30 MVA) LAT DT Norte - Ruta Dos (132 kV) de 13 km"
"Transba";"ET Norte";"LAT DT Vivoratá - Norte (132 kV)de 21 km"
"Transba";"EETT Villa Lía -Baradero";"LAT Villa Lía - Baradero (132 kV) de 50 km"
"Transba";"ET Pergamino Industrial";"Nueva ET Pergamino Industrial 132/33/13.2 kV, (30 MVA), seccionando LAT Pergamino - Rojas"
"Transba";"ET San Pedro Ind.";"Nueva ET San Pedro industrial 132/33/13.2 kV, (2 x30 MVA), vinculado con una LAT (132 kV) a Papel Prensa"
"Transba";"ET C. Sarmiento";"Nueva ET C. Sarmiento 132/33/13.2 kV, (30 MVA) LaT C. Sarmiento - S.A. Areco Dos (132 kV) de 32 km"
"Transba";"ET Luján Industrial";"Nueva ET Lujan Industrial - 132/33/13.2 kV (2 x 30 MVA). LAT Lujan Industrial - Luján II (132 kV) de 6 km LAT Lujan Industrial - Luján (132 kV) de 3 km"
"Transba";"ET Costa Esmeralda";"Nueva ET Costa Esmeralda -132/33/13.2 kV (2 x 30 MVA) LAT Costa Esmeralda - Mar de Ajo (132 kV) de 26.4 km LAT Costa Esmeralda - Pinamar (132 kV) de 20 km"
"Transba";"EETT San Nicolás Norte -Ramallo";"LAT San Nicolás Norte - Ramallo (132 kV)13 km"
"Transba";"ET Mercedes Dos";"Nueva ET Mercedes Dos-132/33/13.2 kV (30MVA) LaT Mercedes-Mercedes Dos (132kV) de 13 km"
"Transba";"ET Junín Sur";"Nueva ET Junín Sur-132/33/13.2 kV (30 MVA) LATChacabuco Ind. - Junín Sur (132 kV) de 48 km"
"Transba";"ET Roque Pérez";"Nueva ET Roque Pérez-132/33/13.2 kV (30 MVA)."
"Transba";"ET 25 de Mayo Dos";"Nueva ET 25 de Mayo Dos-132/33/13.2 kV (30 MVA) seccionando la futura LAT Bragado - 25 de Mayo"
"Transba";"ET Puan";"Nueva ET Puan-132/33/13.2kV (2 x 30 MVA) seccionando LAT Guatraché -Pigué"
"Transba";"EETT Brandsen -Kaiser";"Doble Terna Brandsen - Kaiser (132 kV) de 35 km"
"Transba";"ET Campana Puerto";"Nueva ET Campana Puerto-132/33/13.2 kV (45 MVA) LAT Campana Puerto -Campana Tres(132 kV)7km LATCampana Puerto- Campana (132kV) de 7km"
"Transba";"ET Este";"Nueva ET Este (B. Blanca)-132/33/13.2 kV (2 x30 MVA) seccionando LAT B. Blanca P. Alta"
"Transba";"EETT Arrecifes Pergamino";"LATArrecifes - Pergamino (132 kV) de44 km"
"Transba";"EETT T.Lauquen - Saliquelló";"LAT T. Lauquen - Saliquelló (132 kV) de 100 km"
"Transba";"EETT T.Lauquen - G. Villegas";"LAT T. Lauquen - G. Villegas (132 kV) de 115 km"
"Transba";"EETT Lobos Monte";"LAT Lobos-Monte (132 kV) de 48 km"
"Transba";"EETT Villa Gesell Mar de Ajó";"LAT Villa Gesell - Mar de Ajó (132 kV) de 66 km"
"Transba";"EETT Mar de Ajó -L. Toninas";"LAT Mar de Ajó - L. Toninas (132 kV) de 30 km"
"Transba";"ET Olavarría Tres";"Nueva ET Olavarría Tres-132/33/13.2 kV (2 x 30 MVA), seccionando Olavarría -La Pampita y Olavarría - L. Negra"
"Transba";"ET Guaminí";"LAT Guaminí - Saliquelló (132 kV) de 70 km"
"Transba";"EETT Ramallo -Ramallo Industrial";"LAT: Segundo circuito Ramallo - Ramallo Industrial. (132 kV) de 18 km"
"Transba";"EET T Macachín -Puán";"LAT Macachín - Puán (132 kV) de 95 km"
"Transba";"EETT C. Suárez -C. Pringles";"LAT C. Suárez - C. Pringles (132 kV) de 95 km"
"Transba";"ET Chascomús";"Remplazo de T2CU de 15/10/15 MVA por otro de 30/20/30 MVA"
"Transba";"ET Las Armas";"Instalación de un 2° transformador 132/34,5/13,8 kV - 15/10/15 MVA (Se puede utilizar el de Balcarce, Barker o Zarate)"
"Transba";"ET Tres Arroyos";"Instalación tercer transformador 132/33/13,2 kV 30/30/10 MVA."
"Transba";"ET G. Chaves";"Instalación 2do transformador de 15/10/15 MVA - 132/33/13,2 kV (transformador existente)"
"Transba";"ET Mar de Ajó";"Remplazo de un transformador T2MJ 132/33/13,2 kV - 15/10/15 MVA por otro de 30/10/30 MVA - 132/34.5/13.8 kV"
"Transba";"ET Miramar";"Reemplazo de los transformadores T1 MR y T2MR 132/33/13,2 kV - 15/10/15 MVA por otros de 30/20/30 MVA -132/34.5/13.8 kV"
"Transba";"ET IMSA";"Segundo transformador 132/33/13,2 kV -15/10/15 MVA"
"Transba";"ET Rojas";"Reemplazo transformador actual T1RF de 15/10/15 MVA - 132/33/13.2 kV por otro de 30/20/30 MVA - 132/33/13.2 kV"
"Transba";"ET Norte II";"Instalación de un 3° transformador 132/34,5/13,8 kV - 45/30/45 MVA y adecuación de la ET."
"Transba";"ET Quequén";"Instalación de nuevo transformador 15/10/15 MVA y adecuación de la ET."
"Transba";"ET Colón";"Instalación de un 2° transformador 132/34,5/13,8 kV - 30/20/30 MVA -Segunda barra de 132 kV."
"Transba";"ET Coronel Suárez";"Reemplazo de los dos transformadores 15/10/15MVA por dos nuevos transformadores de 30/30/20 MVA"
"Transba";"ET Monte";"Remplazo de actuales transformadores de 15 MVA por transformadores 132/34.5/13.8 kV - 30/20/30 MVA."
"Transba";"ET Valeria del Mar";"Instalación de un segundo transformador 132/34.5/13.8 kV -15/10/15 MVA (el original de la ET)"
"Transba";"ET Balcarce";"Tercer transformador 30/30/20 MVA"
"Transba";"ET Tornquist";"Instalación de un segundo transformador 132/33/13,2 kV 30/20/30 MVA"
"Transba";"ET Villa Gesell";"Remplazo del segundo transformador (T2VG) de 15/10/15 MVA por uno de 30/20/30 MVA mas otro 30/20/30"
"Transba";"ET Las Palmas";"Instalación de un tercer transformador 132/33/13,2 kV 30/30/20 MVA."
"Transba";"ET Chacabuco Industrial";"Instalación de un 2° transformador 132/33/13,2 kV - 15/10/15 MVA proveniente de la ET Chacabuco"
"Transba";"ET Bragado";"Remplazo del T5BG de 10 MVA por otro de 30/30/20 y el T6BG de 15 MVA por otro de 30/30/20"
"Transba";"ET Gral Madariaga";"Instalación de un transformador 132/34,5/13,8 kV - 15/10/15 MVA."
"Transba";"ET Azul";"Reemplazo de un trafo de 15 por otro 132/33/13,2 kV 30/30/20 MVA"
"Transba";"ET Villa Gesell";"Instalación de un tercer transformador 132/33/13,2 kV 30/20/30 MVA"
"Transba";"ET Ramallo Industrial:";"Segundo transformador de 132/33/13 kV 40/40/15 MVA"
"Transba";"ET C. Casares";"Reemplazo del T1CJ de 5 MVA - 66/33 kV por uno 15/10/15 MVA - 66/33/13 kV vinculando a 33 y 13 kV."
"Transba";"ET Villa Lía";"Instalación de un segundo transformador 220/132kV-150MVA"
"Transba";"ET Las Toninas";"Ampliación ET incorporando un nuevo transformador 132/34,5/13,8 kV -30/20/30MVA."
"Transba";"ET Mar del Tuyú:";"Instalación de un segundo transformador 132/34,5/13,8 kV - 30/20/30 MVA."
"Transba";"ET Chacabuco";"Reemplazo del transformador T2CB 132/33/13,2 kV - 15/10/15 MVA por otro de 30/20/30 MVA"
"Transba";"ET Punta Alta";"Remplazo del transformador T1PV por uno de 30/30/20 MVA"
"Transba";"ET Chivilcoy Dos";"Instalación de un segundo transformador de potencia de 30/20/30 MVA -132/33/13.2 kV"
"Transba";"ET Mercedes Dos";"Instalación de un segundo transformador de potencia de 30/20/30 MVA"
"Transba";"ET Cardales";"Instalación de un segundo transformador de potencia de 45/45/45 MVA -132/33/13.2 kV"
"Transba";"ET Junín sur";"Instalación de un segundo transformador de potencia de 30/20/30 MVA -132/33/13.2 kV"
"Transba";"ET Campana Puerto";"Instalación de un segundo transformador de potencia de 45/45/45 MVA"
"Transba";"ET Rojas";"Reemplazo del transformador T2RF de 15/10/15 MVA - 132/33/13.2 kV existente por una nueva máquina de 30/20/30 MVA"
"Transba";"ET S. A. de Giles";"Instalación de un segundo transformador de potencia de 30/20/30 MVA -132/33/13.2 kV"
"Transba";"ET Ramallo Industrial";"Reemplazo del transformador T1RN de 30/30/20 MVA - 132/33/13.2 kV existente por una nueva máquina de 45/45/45 MVA"
"Transba";"ET Laprida";"Reemplazo del actual trafo de 132/13.2 kV 10 MVA y el de 33/13.2 kV 5 MVA por uno de 15/10/15 MVA"
"Transba";"ET Chañares";"Reemplazo de las dos máquinas de 30/20/30 MVA por otras dos de 45/30/45 MVA"
"Transba";"ET Pigüe";"Reemplazo de las dos máquinas de 15/10/15 MVA por otras dos de 30/30/20 MVA"
"Transba";"ET Monte Hermoso";"Instalación de un 2° transformador 132/33/13,2 kV - 15/10/15 MVA"
"Transba";"ET 25 de Mayo Dos";"Instalación de un segundo transformador de potencia de 30/30/20 MVA -132/33/13.2 kV"
"Transba";"ET Roque Pérez";"Instalación de un segundo transformador de potencia de 30/20/30 MVA"
"Transba";"EETT Campana -Corcemar - Campana - Corcemar (1CACO1)";"Conductores (535 A)"
"Transba";"EETT Corcemar - Toyota - Corcemar - Toyota (1CO-TOY1)";"Conductores (535 A)"
"Transba";"EETT Toyota - Zárate - Toyota - Zárate (1TOY-ZA1)";"Conductores (535 A)"
"Transba";"EETT Campana -Praxair - Campana - Praxair (1CAPX1)";"Conductores (535 A)"
"Transba";"ET Arrecifes - Arrecifes - C. Sarmiento (6CTAS1)";"TI (150 A)"
"Transba";"ET Rojas - Pergamino - Rojas (1PORF1)";"TI (300 A)"
"Transba";"ET Rojas - Junín - Rojas (1JURF1)";"TI (300 A)"
"Transba";"EETT Luján - Morón 2 - Luján - Morón 2 (1LJMB2)";"Conductores (475 A)"
"Transba";"EETT Luján Dos -Morón 1 - Luján Dos - Morón 1 (1LDMB1)";"Conductores (475 A)"
"Transba";"ET Mercedes - Luján - Mercedes (1LJMD1)";"TI (300 A)"
"Transba";"ET Azul - Azul - Cacharí (1AZCC1)";"TI (300 A)"
"Transba";"ET Las Flores - Cachacrí - Las Flores (1CCLF1)";"TI (300 A)"
"Transba";"EETT Chascomús y Verónica - Chascomús - Verónica (1CUVR1)";"TI en ambos extremos (300 A)"
"Transba";"JUNÍN - EMP DIST ENERG NORTE";"T1JU 132/34.5/13.8 kV 30/20/30 MVA T2JU 132/34.5/13.8 kV 30/20/30 MVA"
"Transba";"BRAGADO - COOP. MNO. MORENO BS. AS./ EMP DIST ENERG NORTE";"T3BG 132/66/13.2 kV 20/20/10 MVA T4BG 132/69/13.8 kV 20/20/10 MVA"
"Transba";"LAS TONINAS - EMP DIST ENERG ATLANTICA";"T1LO 132/34.5/13.8 kV 30/30/20 MVA"
"Transba";"C. SARMIENTO - EMP DIST ENERG NORTE";"T1CT 66/34.5/13.8 kV 10/5/10 MVA T2CT 66/34.5/13.8 kV 10/5/10 MVA"
"Transba";"QUEQUÉN - COOPERATIVA DE NECOCHEA/ EMP DIST ENERG ATLANTICA";"T1QU 132/34.5/13.8 kV 15/10/15 MVA"
"Transba";"HENDERSON - EMP DIST ENERG NORTE";"T5HE 132/34.5/13.8 kV 15/10/15 MVA T6HE 132/34.5/13.8 kV 20/20/6.6 MVA"
"Transba";"TANDIL - EMP DIST ENERG ATLANTICA/ USINA POPULAR DE TANDIL-DISTR";"T1TD 132/34.5/13.8 kV 30/20/30 MVA T2TD 132/34.5/13.8 kV 30/20/30 MVA T3TD 132/34.5/13.8 kV 30/20/30 MVA"
"Transba";"MAR DE AJÓ - CESOP LTDA SAN BERNARDO/ EMP DIST ENERG ATLANTICA";"T1MJ 132/34,5/13,8 kV 30/10/30 MVA T2MJ 132/34,5/13,8 kV 15/10/15 MVA"
"Transba";"LINCOLN - EMP DIST ENERG NORTE";"T1LI 132/34.5/13.8 kV 15/10/15 MVA T2LI 132/34.5/13.8 kV 15/10/15 MVA"
"Transba";"9 DE JULIO - COOP. DE M. MORENO B.A.";"T1NJ 66/13.8 kV 10/10 MVA T2NJ 66/13.8 kV 10/10 MVA"
"Transba";"P. PRENSA - COOP. DE SAN PEDRO";"T1PS 132/34.5/13.8 kV 15/15/5 MVA"
"Transba";"SAN PEDRO - EMP DIST ENERG NORTE / COOP. DE SAN PEDRO";"T1SH 132/34.5/13.8 kV 15/10/15 MVA T2SH 132/34.5/13.8 kV 15/15/10 MVA"
"Transba";"V. GESELL - EMP DIST ENERG ATLANTICA / COOP. V. GESELL";"T1VG 132/34.5/13.8 kV 30/20/30 MVA T2VG 132/34.5/13.8 kV 15/10/15 MVA"
"Transpa";"ET Santa Cruz Norte y C. Rivadavia.";"Alternativa 1 – doble terna 132kV ZN-KM9"
"Transpa";"ET Santa Cruz Norte y C. Rivadavia.";"Alternativa 2 – Obra Comodoro Rivadavia 500kV"
"Transpa";"ET Puerto Madryn ";"Reemplazo del Autotransformador 01 de 60MVA del Campo 01-330kV por un Transformador de 120MVA marca Toshiba para ingreso de los primeros 70MW del PEM I de Genneia y Acceso del Transformador Faraday de 120MVA sobre un nuevo Campo 10-330kV por FOTAE."
"Transpa";" Zona Norte de Chubut (Anillo Norte en 132kV primer etapa).";"Construcción de la nueva ET PS (Pto. Madryn Sur), la cual se vincularía seccionando la actual línea de 132kV Loma Blanca – Pto. Madryn. Construcción de doble terna 132kV desde el seccionamiento en “T” hasta nueva ET PS, un Campo para la conexión de un Transformador de 132/33/13,2kV de 30MVA, y Campos de línea correspondientes para la doble terna."
"Transpa";" Zona Norte de Chubut (Anillo Norte en 132kV segunda etapa).";"Construcción de una Línea de 132kV desde la ET Loma Blanca hasta la ET Rawson."
"Transpa";"ET Pto Madryn Sur";"ET Pto Madryn Sur (PS) alimentada directamente
desde la red de 132kV"
"Transpa";"Nueva ET 132kV en Trelew";"Transformador de 30/30/20MVA 132/33/13,2kV"
"Transpa";"C.R. ET B° San Martín, Ampliación Capacidad de Transformación";"Instalación de un nuevo transformador N°4 30MVA
132/34,5/13,2kV en reemplazo del de 15MVA."
"Transpa";"Ampliaciones NEA y NOA";"
"Transpa";"Ubicación";"Equipos involucrados"
"Transpa";"ET Monte Quemado 500 kV";"Compensación serie del 70% en las salidas de línea de 500 kV hacia ET Cobos y hacia ET Chaco."
"Transpa";"EETT Recreo y La Rioja Sur 500 kV";"LAT Recreo - La Rioja Sur 500 kV: Reemplazo de la actual compensación (150 MVAr en LA y 85 MVAr en RE) por un único reactor de 80 MVAr (aislado de tierra) en el extremo de La Rioja Sur."
"Transpa";"Ampliaciones Corredor Comahue-Cuyo";"
"Transpa";"Ubicación";"Equipos involucrados"
"Transpa";"EETT Rio Diamante, Chihuido y Chocón Oeste";"Compensación serie del 35% en ET Río Diamante, en salida de línea a Agua del Cajón (línea existente) ^. Nueva CH Chihuido en 500 kV y LAT 500 kV Chihuido - Chocón Oeste de 160 km de longitud. Línea 500 kV Chihuido-Río Diamante de 450 km, con compensación serie en ET Río Diamante."
"Transpa";"EETT Nueva San Juan, Rodeo/Iglesia y La Rioja Sur ^ ©";"1ra Etapa: Nueva ET Rodeo 500/132 kV - 300 MVA con reactor de barra en 500 kV de 50 MVAr. Línea de 500 kV Nueva San Juan - Rodeo de 150 km de longitud. 2da Etapa: Línea de 500 kV La Rioja Sur-Rodeo de 300 km de longitud."
"Transpa";"EETT Rodeo y Calingasta";"Nueva ET Calingasta 500/132 kV - 450 MVA. Vinculación a 500 kV de la línea Rodeo - Calingasta de 95 km de longitud, actualmente operada en 132 kV."
"Transpa";"EETT La Rioja Sur, Chumbicha, Saujil y El Bracho";"Nueva ET Chumbicha 500/132 kV - 450 MVA con reactor de barra de 500 MVAr. Nueva ET Saujil 500/132 kV - 450 MVA. Línea de 500 kV La Rioja Sur-Chumbicha de 65 km de longitud. Línea de 500 kV Chumbicha - Saujil de 100 km de longitud. Línea de 500 kV Bracho - Saujil de 200 km de longitud."
"Transpa";"ET Arrollo Cabral 500 kV";"Ampliación de la capacidad de transformación a 132 kV. Instalación de un segundo transformador 500/132 kV -300 MVA."
